{
  "firstName": "Ivan",
  "surName": "Venus",
  "middleName": "W",
  "birthDate": "2001-08-01",
  "age": 20,
  "birthPlace": "Russia",
  "sex": "male",
  "passportNum": "1410445442",
  "phoneNumber": "+78411001101",
  "accounts": [{
    "accNumber": "0511",
    "accCurrency": "USD"
  },
    {
      "accNumber": "02222",
      "accCurrency": "USD"
    }
  ]
}